Obdachloser, Superheld, Schüler, Lehrer, Stripper, Astronaut, Geist, Psychopat, König, Prinz, Schauspieler, Alien, Wissenschaftler
2. Weltkreig, 1. Weltkrieg, Zukunft, Mittelalter, Dinosaurierzeit, Renaissance, Gegenwart, Steinzeit
Zeitreise gemacht, Kann zeitreisen, Keine Erfahrung mit Waffen/Kampfkunst, Fehlt ein Arm/Bein, Geistige Behinderung, Angefahren worden, Superkräfte, Intelligenz, Arroganz
Mond, Unter Wasser, Frankreich, Antarktis, Königreich auf den Wolken, Land hinter den Bergen, Hölle, Königreich unter der Erde, Schule, Einkaufszentrum, Arbeitsbüro, Museum, Vulkan
Vater ist der Teufel, Eltern sind Tot, Zeitreisender hat gesagt die Welt geht unter, Liebe, Rache, Freiheit, Abenteuer, Macht
Alien Herrschaft, Kein Geld, Krieg, Vulkan ausbruch, Zombieapokalypse, Steckt im Labyrinth fest, Menschen sind extinkt
